{"$schema":"https://json-schema.org/draft/2020-12/schema","$id":"https://sdk.tokensaver.app/schemas/plugin-manifest.v1.json","title":"TokenSaver Plugin Manifest v1","type":"object","required":["apiVersion","id","name","version","creator","runtime"],"properties":{"$schema":{"type":"string","format":"uri"},"apiVersion":{"const":1},"id":{"type":"string","maxLength":128,"pattern":"^[a-z0-9]([a-z0-9-]{0,61}[a-z0-9])?(\\.[a-z0-9]([a-z0-9-]{0,61}[a-z0-9])?){2,}$"},"name":{"type":"string","minLength":1,"maxLength":64},"version":{"type":"string","pattern":"^[0-9]+\\.[0-9]+\\.[0-9]+([-+][0-9A-Za-z.-]+)?$"},"creator":{"type":"object","required":["name"],"properties":{"name":{"type":"string","minLength":1},"url":{"type":"string"},"email":{"type":"string"}},"additionalProperties":true},"description":{"type":"string"},"license":{"type":"string"},"permissions":{"type":"array","maxItems":0},"runtime":{"type":"object","required":["kind","entry"],"properties":{"kind":{"const":"executable"},"entry":{"type":"object","minProperties":1,"additionalProperties":{"type":"string"}},"args":{"type":"array","maxItems":32,"items":{"type":"string","maxLength":4096,"pattern":"^[^\\u0000]*$","$comment":"The host and workbench enforce 4096 UTF-8 bytes, which is stricter than JSON Schema maxLength for non-ASCII text."}}},"additionalProperties":true},"capabilities":{"type":"object","properties":{"kinds":{"type":"array","items":{"enum":["test","build","lint","status","log"]},"uniqueItems":true},"maxInputBytes":{"type":"integer","minimum":0,"maximum":16777216}},"additionalProperties":true},"limits":{"type":"object","properties":{"timeBudgetMs":{"anyOf":[{"const":0},{"type":"integer","minimum":50,"maximum":1000}]}},"additionalProperties":true},"integrity":{"type":"object","required":["algorithm","digests"],"properties":{"algorithm":{"const":"sha256"},"digests":{"type":"object","minProperties":1,"additionalProperties":{"type":"string","pattern":"^sha256:[0-9a-f]{64}$"}}},"additionalProperties":true}},"additionalProperties":true}
