{
  "$schema": "https://sdk.tokensaver.app/schemas/plugin-manifest.v1.json",
  "apiVersion": 1,
  "id": "com.vic-e.tokensaver.caveman",
  "name": "Caveman Output Compatibility Optimizer",
  "version": "0.1.1",
  "creator": {
    "name": "VIC-E",
    "url": "https://vic-e.com"
  },
  "description": "Community compatibility optimizer for verbose Caveman diagnostics. Not affiliated with or endorsed by Caveman or Julius Brussee.",
  "license": "Apache-2.0",
  "runtime": {
    "kind": "executable",
    "entry": {
      "windows-x64": "bin/windows-x64/tokensaver-caveman-plugin.exe",
      "windows-arm64": "bin/windows-arm64/tokensaver-caveman-plugin.exe",
      "linux-x64": "bin/linux-x64/tokensaver-caveman-plugin",
      "linux-arm64": "bin/linux-arm64/tokensaver-caveman-plugin",
      "darwin-x64": "bin/darwin-x64/tokensaver-caveman-plugin",
      "darwin-arm64": "bin/darwin-arm64/tokensaver-caveman-plugin"
    }
  },
  "capabilities": {
    "kinds": ["test", "build", "lint", "status", "log"],
    "maxInputBytes": 16777216
  },
  "limits": {
    "timeBudgetMs": 250
  },
  "permissions": []
}
